Input,Markov Chain Output,LSTM Output
"A little over a month ago I was tossed out of my apartment by my now ex-girlfriend.  I was sleeping on my friends couch for a week, and then my job asked me if I wanted to travel to another location temporarily.  Originally it was supposed to be 30 days, but I signed another 90 day commitment so my total time out will be 120 days.  It has just sunk in on me that I'm effectively homeless, living out of a hotel room with nowhere to go.  Fortunately my job put me in the hotel and are paying for it.  I just need someone to give me words of encouragement."," if you or someone you know is contemplating suicide , please reach out . you can find help at a national suicide prevention","always pleasant to think about your potential , but for people like us . It went along the lines of and I'm paraphrasing: ""The greatest moving force people experience concerning their future comes from not the positive thoughts about their dreams and goals , but instead it is the fear of where they could end up if they stop moving forward""I do believe effort matters , because YOU learning new processes and giving it your all is what adds most to your character development ."
"I just had a rather horrid binge, and this has been a problem Ive been dealing with ever since childhood. Its hard for me to be kind to myself after I decided to stuff my face to the point of getting sick instead of looking after myself. Does anyone have kind words to offer? Thank you for taking the time to read this. I sincerely appreciate it from the bottom of my heart. "," i know someone here already said this , but if you need to talk or vent , please pm me . good luck ! you got this ! <END>","you need help understanding something , or even if they tell you it's stupid , listen to yourself over all of them . We all doFriend , this wont last forever . You said youre actually pretty good . Second of all , repeat after me: I am a stranger who will listen , so feel free ) or calling a crisis line or something ."
I really don't feel good about myself and everything feels like it's falling apart and I'm trying so hard to do everything i can but everything always feels like it backfires... I really don't know what to do anymore...," i am not saying hey , you look like you have a problem . i am saying that everyone should visit a psychologist every",And if we're fighting the system . . . I really hope I could pray for you face to face and let you feel hope again because I know how you are . I like the idea of getting a tutor . Form a study group with your friends as well .
"On top of all this, I had a falling out with one of my best friends and he turned some of my other friends against me. I just cant help but feel like everything bad that happens in my life is a direct result of my actions. I had no reason to think that the girl I was talking to would have liked me in the first place. We were barely friends before but after I asked for her number we got really close. She said the reason she doesnt want to make our relationship anything more is because she doesnt want to destroy the relationship we have right now. I dont know how true that actually is. I want to be friends with her but I dont know if she honestly values our friendship or if that is just a load of crap to make me feel better. I feel like Im a failure and I feel like I hurt everyone I'm involved with. If youve read all of this I appreciate it and any advice is appreciated"," if you or someone you know is contemplating suicide , please reach out . you can find help at a national suicide prevention","testosterone levels ramp up and your hormones too , all of a sudden youll develop . Give it another year or two and itll pay off huge . Youll probably be burning over 150kcal/mil . Walking 3 miles per day alone would have you probably burning a pound a week ."
"So, my car is kind of my home. I keep all my stuff in my car all the time (so yes, it's a mess). This arrangement will only last until Christmas break, so I have like 10 more weeks to go like this. This whole thing was my decision and done by my own hand, so I really have no right to complain, but it is still confusing and difficult. To make it all even more weird, one of my professors also hired me to house/dog sit a few nights a week, so I'll also be staying in a third house sometimes coming up. Anyone else ever lived out of their car, kinda? Please share any encouraging thoughts or ideas with me to get through this odd phase of my life!!!", find peace in that these things are just for now and it is really only but a blink of any eye in the rest of your lifetime,"work , especially with chronic severe migraines as well . Dont put too much pressure on yourself . My dad told me when I was bouncing around . It made me relaize that I don't dwell on my own screw ups too long , I am not saying ""hey , You look like You have a lot more worse things to be embarrassed or judged by , so dont let this get you down ."
"If you take the time to read this, thank you.If you arent sure what to say afterwards, thats ok.If you are going to reply with the intent to help me, please exclude any exclamation points. I realize that this might seem insignificant, but I cant handle any more exclamation points. Especially if its located at the end of a platitude. Everything is going to be fine? CONVINCE ME.I am 31, male. Diagnosed bipolar mixed state. When Im manic, I often get fixated on ideas/concepts. In my most recent episode, I came up with an idea for a patent. Although my mania has subsided, Im still convinced that my idea is worthwhile, so Im not going to reveal the specifics. Sorry.I was so overwhelmed with excitement, that I went to my friends apartment to share the idea with them."," if that means getting up early to do a hobby before work , or read a book at night , or something that you enjoy , just",just one of them too . The society we live in makes it so easy to think its the end of the day no one can take away from you what you did wrong ( if you already do this skip this sentence ) .
"Ive been in touch with the program director and shes working with me after I told her my past history with everything now its just a matter of waiting on the transcripts. If I need extra classes I can take them potentially before the program starts. So hope all things go well for me. But its all dependent on what transfer from UAB to them. However I know its a long shot, but I rather find out now and see what I can do or I can always start this program in the fall as well. This is where Im at today. So what do you mean you paused medical school?:I never want to let go of my dreams of becoming a doctor.", i know from experience that there is a huge sense of relief when you leave an abusive relationship so hang onto that,"it is by experiencing sadness as well . Friend , I wish I could work in an environment where people bring others up and encourage one another . No one wins or improves by cutting each other down . Its hard , but focus on building you at the same time letting her know youre still her best friend for years and she couldn't imagine romantic feelings for me ."
"Ok so I'm pretty freaked out right now. Both because this is my first time posting, and because today I posted my first (and very rough) YT video.Some context: I live away from my family, they're in Indonesia and I'm in Sydney. I visit every year for Xmas, but this time it got sadder to go back to work after the holidays. I realised that I'd usually keep my head down at work for a whole year, and it started to feel sad and pointless. When I met up with a close friend while I was home, we talked about what really makes you feel happy, and singing is something that came up for as I felt it was like an outlet.", the future is not hopeless and you are not worthless . <END>,"parties , have fun movie/slumber parties in a homemade fort , take your meds . It's important to validate yourself because that's the most ( and only ) organic way to begin to recover . No uNo , I think . From what you've said in four paragraphs:1 ) Brand new job with ( presumably ) less - abusive boss ."
"Then he starts going on a rant and calls me all kinds of names and continues to insult me.I keep calling him out on his irrational behavior and all he can say is, ""if you think I'm such a bitch, I'll call my cousin to come and beat your ass, she has nothing to lose"" I tell him this is not a very good idea to do for him to do. I asked for the babies items we received for our baby shower and he keeps telling me that I'm not getting anything that I didn't pay for. He takes things a step further by saying that he wasn't putting me on his insurance and I should get my fake family to pay for the hospital bill since they want to give fake speeches at the baby shower.", i know from experience that there is a huge sense of relief when you leave an abusive relationship so hang onto that,"and homeless . Its not the end . If it isnt worked out , its not worth sacrificing your time for a few extra bucks a day when its making you miserable . Karma is definitely real on the mental level - hurting others hurts your mind and distract yourself ."
"Hi Reddit! I could use some encouragement. My living situation is really weird right now. Three days/nights a week, I live in a small city for my master's program. During that time,  I live in a house with this random older woman (she's nice, but still random) and a roommate. It's comfortable enough, but def not my home and I always feel like a stranger/guest. The other three nights a week, I live with my fiance four hours north in an apartment that we don't love in a town we both hate (it's super rural, we miss our families & friends in another state, etc). So, half the week I'm at school in a weird living situation, and the other half I'm with my fiance in a weird living situation."," in times like those , one of the best things you can do is to remember that your current situation is temporary . it","teach you that people too must wilt , fall , root , rise , in order to bloom . ""Look at the people here who believe in you and I hope it helps encourage u for the next decade ahead . a wise man once said its better to have a thoughtful discussion sometime : ) , your stranger friendI have a math degree and failed Calc 2 ."
"I just got back from a trip and I am miserable. I currently live in a town I dont like while waiting to go back to Uni. Its been a rough time and Im having a bad day. Feeling unproductive, sad, and wishing I was in school and not in this slow, boring town. I spend 9 hours a day on my phone. I am always in bed, watching boring tv shows. None of the non credit classes I wanted to take work for my schedule. I am in a transition with my job so my pay is less than it used to be. It sucks.Its also my mothers birthday and I dont want to be a party pooper at her B-Day dinner! So I could use some encouragement, toasting, and maybe even suggestions of stuff to do."," if you or someone you know is contemplating suicide , please reach out . you can find help at a national suicide prevention","your job , it's hard to hear , but actually one of the siblings that isnt married so she is constantly doing everything for me . I too am looking forward to this all week . Even after my birthday that happened this past Wednesday ."
"Ive gone through bulimia. Many nights of sobbing. Ive gone through so much self-hate.If you dont agree with someones dream, dont tell them these things. I am personally so so damaged from it all and I struggle everyday to feel good about myself and I feel so so dumb I still fight for my dream. I still fight even though Im apparently ugly, fat and whatever. Can you please be nice to people? Can you please make one less girl feel hideous ?I dont talk to my family anymore. That was just the tip of the ice berg with them. I am moving on, but Im never losing my dream... even if people lsugh at me."," if you or someone you know is contemplating suicide , please reach out . you can find help at a national suicide prevention","in until 7 minutes before your shift , so that's usually a good number . It's possible to get a graphic design business going ( nothing major , just something small ) , but that may be an option if you're still feeling this way , and that you are working with your dog is so cool ! You clearly love your canine buddy ! It seems like the perfect gift and the extra effort to help and prove yourself ."
"last Saturday I got my first job outside of Upwork after a week.:)I know that I am being impatient and that these things take time, I can rationalize that...But I would love some words of encouragement in these times.Any advice is also welcome.Thank you in advance."," if you or someone you know is contemplating suicide , please reach out . you can find help at a national suicide prevention","secret he is scared , he doesn't want to get into an argument and never to start one . Whatever someones says just leave it to them . I would advise you seek out a therapist if possible . If youre working full - time , consider taking fewer credit hours , maybe only 2 classes a semester to start , and use summer semester to make up the extra credit hours ."
Thank you all for your kind words.," a good partner would have been extra affectionate throughout your recovery , made sure you took enough time to get better","i never loved you . Eight years of my life and remember coming home and crying in my room mostly . His constant negativity and criticism is what made me draw away from trying to talk to people about it , which You are doing your best and that is what you feel is right , then go ahead ."
"I've been friends with this guy from across the country for 2 or 3 years now, and I feel like he's been causing me pain for a while now. I truly thought I enjoyed his company, but now it feels like a redundant step down morally. He somehow manages to make everyone think he's enjoyable to talk to. Meanwhile everyone in the Xbox party is being told why their bad or why he's not playing now and it's your fault. I don't want to end a friendship with someone that's been a part of my life for so long, but him and everyone else on there keeps dragging me back."," i know someone here already said this , but if you need to talk or vent , please pm me . good luck ! you got this ! <END>",need to see that and give you what I do is just take it one step at a time you most needed her support . You can do this ! Best wishes you'll smash it ! Big deep breath . . . but thank you you 6 people .
About to go take my first driving test here in an hour. I dont really have anyone to talk about this with so I figured Id make something here. I have a lot riding on me passing since the person I get a ride to work with wont be available to help anymore. And if Im being honest Im really nervous., good luck ! <END>,"and meet the expectations that Christ considers . Firstly , false righteousness is perhaps the most eye - piercing of all inwardly held weaknesses . It takes all kinds of people to make the world a better place because of it . You're doing the right thing ."
"I felt good for once. I felt I grew into my looks and I trusted my family would still help me with the surgeries because only then, maybe I could seek their approval for my dreams.There were many times I would say my dreams aloud and people would tell me they wouldnt happen. They claimed Im average looking and nothing special. It didnt make sense to me. How could people openly be so rude? I would go home and stare at myself... re-counting the trauma of bullies and also, the remarks of my family claiming that surgery would make me a goddess.Heres the thing: I told my family again age 18 I was saving my money for LA and I planned to set out to model and act. The whole table let out a huge roar as if Bernie Mac made the best joke ever... so much laughter, pointing their fingers, laughing with unchewed food in their mouth. You an actress? You dont even have the looks!"," you got this ! i did mine a wee while ago , i was absolutely terrified ! in my country the pass rate is really low for","with your family . Admit where you went wrong if you did something wrong ) , you can do this friend . Trust yourself and the important people in your life . Don't get me wrong she still calls me everyday but she doing well with me being gone ."
"For too long now, I have felt like nothing I was doing was helping me. I just need some help and seeing if I officially meet the requirements and seeing what I need to do. Why nursing?:As I mentioned before my passion and my driven mood is in the medical field. One of the most remunerating parts of a role in nursing is the capacity to associate with our patients on such a close level. While we frequently meet under exceptionally troublesome conditionsbeing available as individuals face genuine wellbeing difficulties or wounds, seeing the snapshot of birth or the finish of lifewe become more acquainted with our patients rapidly and have the chance to assume a significant function in their lives. I turned into an attendant so I could affect the lives of others and have a role that felt important.Why not dental, pharmacy, or any other career?I have looked into each of these careers and more but my whole academic career was based around being a medical school student. Ranging from classes to volunteer hours.", i believe in you and your capability to one day become a doctor . nursing could also give you a unique perspective on,"like those , one of the only things that will help you cope with any situation in the future . = ) You can do this ! ! ! That stuff is insanely scary but it's absolutely worth the shot . As for the rest , keep going soldier , never pause , only glide altars , tents' pitched amidst Yah's seat ."
"Today was a great day. I spent the day at Chuck E. Cheese's with my mother, little brother, and my 3 nieces. Bro and I racked up 5,000+ tickets for the girls to spend on prizes. Came home and finished up NaNoWriMo, getting in all 50k words a day early, even though this month was rife with days so full of depression I wanted to just give up on it entirely and binge watch tv or play video games instead.So actually feeling a little bit more productive than usual. Then I get an email from my boss."," if you or someone you know is contemplating suicide , please reach out . you can find help at a national suicide prevention","stressing too much over . I really hope youll be able to work out . I think if you can find a court support worker to sit with you . It's just positive thinking , but it does bring some comfort to me in times of sadness and loneliness , at least ."
I haven't cleaned my apartment in weeks. My husband and I currently live in a low income apartment building which doesn't allow for full student households. He is in school and if I take classes we would have to find another place to live. All of this is stressing me out so much and my husband is stressed out and checked out. I need anyone to talk to but I'm afraid to talk to my friends about this. When I talk to my husband he doesn't say much. I just need even a shred of support from anyone because the person I need it from the most is not in an emotional or mental place to give that.," if you or someone you know is contemplating suicide , please reach out . you can find help at a national suicide prevention","of people who have overcome it . The future is not hopeless and you are sure about them . So lesson learned . Now you can let them shoot you down or you can pivot , and use their crappy comments as motivation to rise above ."
"Its okay. There is nothing wrong with you. Just keep trying and give yourself a break. We are all just kids in adult bodies. Be nice to yourself at the very least. Sigmund Freud said work and love, love and work thats all there is , thats all you need to be happy. Work at something you love and work hard, be fulfilled by it. Surround yourself with people you love and who love you. Work at that love. That is all that matters in this world nothing else will satisfy you. Take a deep breath and lets just do our best!"," if you or someone you know is contemplating suicide , please reach out . you can find help at a national suicide prevention","Everyone fights a battle that you know nothing . So consider yourself wise . Besides , I think you're heading in the right place . All I can say is: what you focus on is what you are given . I hope this helps ."
"My friends say Im pretty but I think theyre lying. Im not the dumbest (my precalc grade would argue otherwise) and Ill admit Im in honor classes and Ive got a poem published in a book but thats about it. I try to stay fit too so its not like, health wise, were super different. I dont think it could ever work out anyways and I dont think his friends would approve of him dating me and I also think that  he would probably go chase the pretty girls that are also in the AP classes and equally as smart as him. I dont know what to do anymore. Hes all this cool stuff and Im just me and I wish he wasnt so out of my league. Im 16 btw if that changes anything", i know you feel like you are absolutely sinking and there's no one around to help but you are absolutely not alone .,"your first draft is about getting the story down . Some parts will be awesome , some will suck , some wont make sense . It's your rough draft , the polishing comes with editing after you finish . If you can't do all of this because I hope you will have deserved it ."
And on top of that my mom kicks me out of the house for 4 hours and I don't have a car so I get to bike in a rainstorm and when I'm finally allowed back in she tells me that I need to fuck off and stop being bad at school. It feels like my life is over and that I'm falling under and that I'm trapped if you have anything to say I'm all ears," i hope you find a job soon , and i hope it treats you well . what ive learned from my experience is that when it comes","a chance to . Believe that . Receive that . I know its hard to notice slight improvement every day but rest assured you are improving . The future you will be okay . I'm sorry that you felt like you were the most - qualified with the most potential and , ultimately , is: do you understand you have value ? And when you accept that fact , it changes your life ."
"So I go into survival mode and wind back upstairs. During this time from Wednesday to Sunday, I am uncomfortable and nervous. I am under the impression that I''m allowed to leave by myself but not with my son. He finally agrees that the hurricane is no longer a threat and that I could go home. I did allow him to see my son, and try to co-parent like he wished but after picking up my son on Tuesday morning and experiencing how my partner was still being aggressive with me, I finally realized how my emotional and physical safety was at risk.I called the police and reported the domestic dispute and he was eventually arrested and forced to do anger management.&amp;#x200B;After everything had happened, I decided to reconnect with him and try again. I knew this was a bad idea, but I wanted a family and I wanted my son to grow up with family. BIG MISTAKE. As soon as this happened, day by day, my partner was showing his true colors again.", i know from experience that there is a huge sense of relief when you leave an abusive relationship so hang onto that,"projects because I am already interested in them . Friend , I've been tracking calories and losing weight , and I'll probably drop one . I am not the type that likes to be jokingly teased . But when it happens on a group it leaves us feeling vulnerable ."
"Im in too low of a funk to consistently care about maintaining my beard which is as frustrating as daily care would be. Ive been gaining fat all of 2020 which not only do I want to lose weight but Im also a nutrition major so thats not a good look. Ive been having toenail issues for about a year now, which tops it off for the head to toe partIm unemployed right now and couldnt get unemployment, so thats really rough. Im really thankful that money isnt as big of an issue as it would be for most people, but I find myself sitting in my car in a random parking lot just to get out of the house."," i know someone here already said this , but if you need to talk or vent , please pm me . good luck ! you got this ! <END>","your part speaks it's just you . The answer will come from inside of you . Second , being 20 is when a lot of regrets and bad memories . There are also a lot of work and I'm proud of you for that ! For what it's worth , go out and see what she says ."
