Input,Markov Chain Output,LSTM Output
"Anyway, I was continuously being flooded with words of encouragement from my relatives, and they very quickly stopped calling me by my name, and instead started calling me ""the biologist"".", i know from experience that there is a huge sense of relief when you leave an abusive relationship so hang onto that,"want a counselor ? Assuming you are of a Christian religious belief , try your ( or any ) pastor . If of another faith , find the equivalent to a pastor . Again , thank you for posting this , I needed it today ."
"Parents pay the car payment and insurance. They control my clothing, friends, dating, phone calls, monitor everything about me, read my diary, create fake instagrams to stalk me. They tell me Im a child, and not an adult until my father walks me down the aisle to my husband someday. Mother says she sees me the same as when I was 15. I have phone recordings of them cursing me out and calling me names.( Im a fifth avenue slut for not having more jobs and for dating when I should be working 16 hours/6 days a week as a young able bodied woman.) I have 3 jobs, I go to college full time, and Im in the military. Im sorry I got pregnant. Im sorry I chose to terminate the baby, but I couldnt possibly bring a child into a situation that I dont even feel safe in. I felt that I had no other options. Please encourage me."," i am cheering for you , and i am inspired by your ability to self reflect and move forward with a plan that you believe","more damaged than you are . I certainly dont say this to provide the impression that you should ignore what you feel like you belong , remember you were chosen by God even when youre just in your mothers womb , He knew every strand of hair of you because He loves you , and that's pretty cool ."
"I've been away from school for a few years dealing with personal things and now I'm finally deciding to go back. I have a lot of doubts and insecurities about how much money I'm spending on a degree that might not actually do me any good, especially since I took a few years off from getting it. But this is not a decision I'm making lightly, and it's one I've spent many many nights thinking about. It seems every time I bring up these fears with people they advise me to keep waiting until I'm sure, or to think about getting a different degree."," i am not sure you are looking for the right direction . i am not a job and getting to give up . however , a lot of us","to call and let someone talk some reality into my crazy thinking . Anything is possible , I just want to practice you craft like before . . . however you can express yourself . The caveat is that youre feeling great to be free of the tyranny ."
"She knew I tried really hard and it wasn't my fault or hers or anyone else's that I didn't graduate. So, anyways her and I talked and she thought it would be a good idea for me to live on disability rather then get a job, so I applied. After 15 years of going to several doctors being diagnosed over and over again with Autism and 15 years of fighting to get on disability or any help for my Autism at all and being denied for any help and disability over and over again for 15 years I was done, I had enough. I just didn't want to keep being diagnosed and fighting for disability and stuff over and over, I was tired of it after 15 years of doing it. All those 15 years I never worked (because if you work or volunteer at all your automatically disqualified for any disability or help at all.) So, I didn't work or volunteer for anything those 15 years and now those years are gone and I can't get them back."," i am cheering for you , and i am inspired by your ability to self reflect and move forward with a plan that you believe","care about your well - being , education , role - models , their entire future ! - - depends on you *should* be a life giver or it could be the death of you if you make sure youre communicating your needs"
"Growing up movies were my escape, fantasy, sci-fi l, action movies.All were better than my life and the older I got the more I wanted to spend time in those worlds than our own.I just thought maybe Ill start a blog doing movie reviews.... A few friends of mine came over for dinner and we got into shit talking and some how landed on doing a YouTube channel We all loved movies and I thought what the heck why not? Whats the worst that could happen?It doesnt get popular, no one watches us..."," if you or someone you know is contemplating suicide , please reach out . you can find help at a national suicide prevention","Sometimes their work was so good that we would play it as house music before the show started and at intermission . Please do share with us . I would also advise you to take every opportunity you can ( as long as they respond without judgement , it should be fine opening up to them ."
"In the end she lashed out at me. I felt really bad and tried to apologize, but she is mostly ignoring me. I won't see her in person for another 3 days.I've been really stressed about this for the past few hours, and I can't help but feel guilty about it, even right now. With my self esteem and social anxiety issues, it is only getting worse. Can anyone please cheer me up a bit and give me some advice on how to properly apologize to her when I'll meet her again?Thanks in advance, and apologies for any mistakes in the post)"," i am cheering for you , and i am inspired by your ability to self reflect and move forward with a plan that you believe","just described , it certainly could be . What you enjoy and don't enjoy , what you like and get fucking organized . Know that you can find a friend who spends three hours a day comes in . Your backyard and inside the home is limiting ."
"So, I really want to start up taking acting classes as I've always wanted to act, like really badly. There are plenty of teenage classes near where I live that I would love to try out but I don't have anybody to go with. Acting classes feel like a thing where people would definitely bring a friend along to help them feel less awkward and so i'm sure that everyone in the classes will have at least one person that they know.The problem I have is that none of my friends are remotely interested in acting and wouldn't join the classes with me. I'm trying to get the courage to go alone but right now i'm way too scared to sign up. Any advice on how to not be such a wimp or how to find a friend that likes acting? If it helps i'm 14F Originally posted on r/advice but not getting responses Any advice is appreciated, have a great day!"," if you or someone you know is contemplating suicide , please reach out . you can find help at a national suicide prevention","reeking havoc on mental health all over the world . It sounds like a jerk to me ) . I usually find that being alone just makes me linger too much on these negative feelings , which makes it harder to want to move on from this relationship and find that you've outgrown it ."
"I am going on a journey of self discovery and Im really scared to open up about something personal that I need to ask. Im afraid that I wont be accepted or that people will treat me differently or like Im not normal if I do open up about this which is why Im deciding to ask a bunch of internet strangers in another sub that is more suited to my issue (sorry guys but this just isnt the right place for THAT encouragement) I really just need to be encouraged that it is ok to open up and dive into this self exploration. Im truly terrified of what others are going to say or do because of my upbringing (very religious, still am) and the nature of the subject at hand :/ I even went to far as to make an alternate account with a new email so my friends and family that use reddit cant find me on here and find out about this before Im good and ready to tell them."," if you or someone you know is contemplating suicide , please reach out . you can find help at a national suicide prevention",i truly hope you make it through . I hope all goes well for you . I feel you . Its a poetic dichotomy . Sorry youre hurting . I am here for you . TL;DR - You'll be just fine . Im a believer in everything happening for a reason .
So I'm only 12 but all my friends have been liked by someone else but no one has ever liked me I wear glasses I have acne All OVER my fucking face Every time I look in the mirror I think about my crush and think why would she ever like thatI just feel like I will never have someone and be lonely all my life help me," i know how you feel that way , but i know you will find them . <END>","that way . I have separated it into paragraphs for you ! Secondly , I'm sorry all this change hit you at once . If your leaders were smart enough to promote you into this role , then trust them to be smart enough to pass your exams now , but through perseverance and by self belief you will look back on this thanking you for sticking to it , dont lose yourself when its hard ."
"I'm in a job position I have no experience in making a lot more than I deserve. It's a very technical and specialized position that I have absolutely no business being in. My boss liked me so I was promoted to this three months ago despite knowing fuck all what I was doing. Since then, I feel like I've done okay. Like I get the job done day to day but it's more like I know what to do, not why I'm doing it like that. My only resource for questions is a forum for this particular type of work for this franchise. It's the only one of it's kind. That's all I have. Anytime I have a question, that's practically my only resource short of toiling through thousands of pages of policy documentation to find what I need. Today I asked a question on the forum for clarification and was completely humiliated for it.", you are doing great in a tough situation already . keep it up and it will pay off . good luck . <END>,"that fact . Oh man , I'm in a similar situation , PTSD , had to live with my bf for three months . The conversation was hard to start the journey , but finding yourself is worth the difficult discussion with your mum ! Hope it goes wellDont feel like its not logical to be anxious ."
"And now, as i watch people tell me that they have no talent, and that nobody could love them, it hurts. I would give up so much to be bad at something again! To be able to scream loudly in the car or use all my paint just to draw something dumb. I would give up my life for some childish enjoyment.Even now, i have a hard time finding ways to feel alive, even if I've given up things like talent,, and the fear of being alone still haunts me every time i open my mouth to sing or pick up a pen to draw,, but i want everyone to remember something,,,Don't give up your happiness for approval. Dance badly in the rain, sing to your favorite song on the radio! Finger paint some fuckin' caterpillars. Annoy the shit out of people, and have the best damn time doing it. Because you are so much more than a talent."," if you or someone you know is contemplating suicide , please reach out . you can find help at a national suicide prevention","to feel better about their day . Im sure college business students would be interested in hearing about it as well . I hope you know somewhere out there , someone is rooting for your success in this world , you mean somethingYou are strong and life will get better , I'm the queen on putting weight on or loosing too much without trying etc , do what makes you happy , or what seems like fun ."
and then he immediately got off the phone with me.Encounter 2- His hotel phone rings. He puts me on mute to take the call. I suspect it was a woman. I ask about it. He denies and says it was a friend who called. I refused to accept. He hangs up the phone and I don't hear from him for the rest of the day as he refuses to take my calls. 2 months later he confesses that a girl did call his hotel phone but he didn't do anything with her and he told me later because he felt that situation was a proud moment for him and I should be proud of him as well.&amp;#x200B;Incident 2My grandmother passes away of cancer and I travel to Philadelphia to celebrate her life and home going ceremony. My partner texts and calls me several times while I was busy with family and mourning the death of my grandmother., i know from experience that there is a huge sense of relief when you leave an abusive relationship so hang onto that,brother has ADHD and it takes him longer to learn things and can be tough but I know you can do anything you set your mind to ! But i have to give myself a party and just not have other people worry about costs of food cause i want to prove for others and just have fun and do no work at all .
"And I found the answer in a verse from bible, Romans 8:28~ and we know that in all things God works for the good of those who love him, who have been called according to his purpose The responsibility I have is to shift my identity and put it in God, because God is permanent. When I put my identity , of who I am in something permanent thats when there is no fear of losing peace, thats when I have nothing to be anxious of. Doesnt it answer our fundamental question. We lose so much of our lives in giving and focusing on temporary needs and dont realise the grave danger of losing out on hope. I found the answer in this Covid 19 situation and somehow Im grateful that I realised it. Im regaining my peace during the madness around me and I want to leave you with this exhortation to shift your identity to Jesus. Because all it took was a pandemic to shift mine in something permanent.."," if you or someone you know is contemplating suicide , please reach out . you can find help at a national suicide prevention","okay . I know one reason you're lucky . Your mom will still be there I'm sure , but you'll also have a strength and self reliance that will help you move along easier . You know , and we see the depths of hate and evil ."
"For thou hast delivered my soul from death, mine eyes from tears, and my feet from falling.  I will walk before the Lord in the land of the living.Psalms 116:8-9 KJVThe psalmist often had to listen to the echo of their own prayers as they cried out to God from a place of isolation. Even if others are around, we can feel lonely if we forget that God is always there. We don't know who wrote Psalm 116, or in what circumstances, but the situation was dire (Seems hopeless). In verse Three he said the pain of death surrounded him and he found trouble and sorrow. During his isolation and fear, he called out to God, and beg God to deliver his soul (verse 4). But in verse 5 we find Gracious is the LORD, and righteous and merciful.No trouble is greater than God's power. Loneliness is a fiction since God is always with us. Call upon Him today and He will hear you, and draw near to you. Have a blessed day.   :)"," i am cheering for you , and i am inspired by your ability to self reflect and move forward with a plan that you believe",done something and didnt . Amen amen amen ! ! ! We are already curious about what the game is about . Some of the ones I had I will cherish forever . I even have a job to keep you from being what you want out of life .
"I came back to the apartment a short time later and told him, ""I am not keeping your son away from you, but I think it's best that I go home with my because we are not getting a long at the moment."" I created space between the both of us, so he would not feel as if I was in his space or threatening him. Instead, he flew into a rage and started to berate me saying that I was keeping his son away from him and I was like every other bitch that tries to hold fathers back from their kids"" I tell him I'm not keeping the baby away from you- I just want to go home. All of a sudden, he is choking me very aggressively. I defended myself by slapping, kicking and scratching him to get off me. He puts me in full nelson and slams me on the couch. I fall on the floor and the altercation is still occurring and I'm still defending myself by kicking and hitting him in the leg.", i know from experience that there is a huge sense of relief when you leave an abusive relationship so hang onto that,"something that would help . I know that sounds like an oversimplification but its true . However I want you to be yourself . ( And besides , if she's into you then she'll appreciate you being authentic anyway ! Honesty is the only foundation for a solid relationship , my dude ."
"Instead of understanding my situation, he starts an argument of purposely ignoring his phone calls to entertain other men in Philadelphia. I never grew up in Philadelphia, I only have family that I visit when tragic things happen. During this argument, he states that he will move back to NY since I don't care about his feelings and that if I wasn't doing anything sneaky, I should answer or send a text to acknowledge him because acknowledgement only takes 2 minutes. Told my aunt during a telephone conversation at my grandmothers funeral that everybody dies and she needs to get over it. At the time I was 3 months pregnant.&amp;#x200B;Incident 3Partner and I have a date night at the fair. After the fair we go back to my apartment complex shopping center to finish the night off with a drink for himself. An argument pursues because I was looking at another man. He proceeds to tell me ""you are about to be a mother with a son."," if you or someone you know is contemplating suicide , please reach out . you can find help at a national suicide prevention","come out bad when you're nervous . Answer honestly , keep them somewhat short and to the point . Think about future parenting obligation . Have sex and the whole 9 yards , let them think what they will . Do what you think is best ."
"I'm short of time and even shorter on motivation and willingness to live. I have no other income than my savings and I'm living with my parents. I also have to spend ALL the fucking day alone, working on my thesis and taking care of myself.I just don't know what to do anymore and it is only making me more anxious and overwhelmed. If maybe some of you could give me some advice or encouraging words, that would be great!Thank you so much for reading."," dont worry about past things that are of have been , its all a distraction to get you away from your relationship with",to attend . Get involved in a church . Even if it's a common interest between you and the hiring supervisor . Knowledge is . . . I understand the exhaustion and utter physical self loathing . I get it . I don't know your particular experience .
"Not seeing future thanksgiving, or Christmas, not seeing that future life we said we both wanted. I die more each time I wake up from that dream life; the pain gets worse; my chest physically hurts right now as I am so heartbroken.I could live with her telling me its not working and she is breaking up with me, that would hurt but its the unknown, the not knowing for sure that she doesnt want me and the why. But I know logically silence is an answer, but how can someone say they love you then be so mean and just drop you from their life, that is not love.I would give anything I have to be held right now, just to be held, to feel wanted, to feel loved, and maybe even be together and remember what being alive means. I am going to try to sleep for a while, I am so tired, maybe my heart will just stop while I sleep and the pain of waking up wont happen, I can only wish it would happen.", the fact that you have 300 pages down is commendable in itself even if it is hot garbage . i do not have the focus to,music . . . The dreams don't have to tell your wife about your feelings ? Have you considered maybe doing therapy ? Or perhaps just an informal talk with a friend could be good for you . . . I understand you may want to leave as soon as the year went on the more I became confident in my skills and more comfortable .
"My wife and I recently moved to be closer to her family to help with childcare. I was making $40,000+/yr at a restaurant. I've worked in restaurants most of my life and have truly come to hate it. So with the move, I decided to try to do something different. So I got a job in a completely different industry and now only make $15.50/ hr, about $30,000/yr. My wife just got a job making $13/hr. I'm struggling seeing us making enough money to obtain our goals. We are currently living with her parents."," if you or someone you know is contemplating suicide , please reach out . you can find help at a national suicide prevention","the right one . the world is an awesome and wonderful place to be . Be how your are now , with the resistance and all . Just an opportunity to reach other places . You will get through this . I believe in you ! : ) Things will be okay ."
"I struggle with depression and so sometimes getting up and out of bed or reminding myself to eat feels like the most difficult thing to do, so I'd like to be able to look back to this post and its comments for that extra bit of push whenever those days come. I know it's easy to fake optimism, but I don't have anyone to go to so anything is appreciated. Thanks."," if you or someone you know is contemplating suicide , please reach out . you can find help at a national suicide prevention","mostly stopped but the face acne remained . I still struggle with my own struggles . Start small though , like taking that walk in the morning . In the end , u/boxesrcool . People survive their internships and live to tell the war stories later ."
"I just finished packing my car by myself! I know its just a small part of moving but I dont know where else to go for encouragement with the little stuff. Both of my parents are out and about so I had to pack by myself, but it was nicer than expected. My (soon to be) roommate is already on the way and my boyfriend is on vacation without cell service, so I dont really have anyone to talk to. I hope everyone is having a great day :)"," i know how you feel that way , but i know you will find them . <END>","youve broken through the hardest part , which is pretty cool . If you can't find an online version of this school , just go for it , since you clearly deserve to be cared for , and anyone you talk to would for sure have better advice than I can offer any advice or encouragement , it's this: Recognize the times/situations where you sabotage yourself ."
"it got to the point where I was terrified to go into work and all they told me was to just leave him alone. so I quit. every time something good happens 10 bad things happen. I wrecked my car and I have a rental car now, but whatever money the insurance gives me my dad is just gonna use to pay off the car that I wrecked. so getting a new car is on me and I have no money. no job. im getting really fucking tired of this shit. all my friends do drugs so I pretty much lost all of them when I got out of rehab. ive stayed clean for the most part, ive only drank and smoked weed a handful of times. i has a job interview today but I couldnt go because I didnt have enough gas in my car. i just want a fucking break.", the only retaliation to that is to keep standing . and when you cant stand because its to much find a couple people who,a second chance . Don't beat yourself up about a mistake though . It's not like riding a bike . And it's free . Lots of times I found myself lost in my room a lot . There are plenty of stories and plenty of illustrations that I have any amazing words of wisdom but I do understand .
"Hi, Im a 14 year old girl who started ballet a few months ago, 14 is VERY late to start ballet especially for a girl. I really want to make ballet a career in the future but today I feel so discouraged. My teacher basically tells us every class well never make it any farther than weve gotten already and tells us about how future professionals our age are already signed with companies, that if were not en pointe by 13 well go nowhere. Im basically having a breakdown right now after class and honestly feel like I should just quit even though I want nothing more in life then to dance. If any of you can give me any sort of encouragement or advice at all I would appreciate it so much. Thank you", you are doing great in a tough situation already . keep it up and it will pay off . good luck . <END>,"will comeAn opportunity to find yourself and know who you are , cause you seem like a big deal , but it also sounds like YOU are caring for yourself , and go ace this and every other class in your way . Only that ."
"There's a reason I work the evening shift. I know this is a petty thing to get hung up on in the face of such an otherwise-perfect opportunity, but it's been a VERY long time since I've been required to get up early on a regular basis. And now I'm on medication with a side effect of insomnia. My current situation is unsustainable, and these early classes will allow me to stick with my usual evening shift; but I have a long history of being easily discouraged and can already feel myself backpedaling. I need someone to talk me out of talking myself out of this.", i know you feel like you are absolutely sinking and there's no one around to help but you are absolutely not alone .,"encouragement beyond what anyone could give you in words ! Also , you want to get a job by May . Sometimes you just need to take some work . Best of luckBEST OF LUCK TO YOU , FRIEND ! I will feel better I will be praying for you , but those weeks , all you can do anything you set your mind to ! But i also think that you're recognizing that that's just too many things to juggle ."
