Input,Markov Chain Output,LSTM Output
"Arguing with me over not answering his phone calls when he thought I should, questioning my whereabouts and who I was hanging out with, and arguing with me about how I was disrespectful to him because I made a sarcastic joke or telling me that my facial expressions and tone of voice was disrespecting him, he would blow this out of proportion and make it seem like I'm antagonizing him, when I was just responding to a question he was asking. I asked him how was my tone and he couldn't tell me.&amp;#x200B;The recent dispute happened when I told him he could not have $1000 from my refund check. I did tell him yes earlier in the month, but after thinking and reconsidering his actions and everything that I have endured like paying for daycare for the past 3 months, and finding out he was going to party instead of working like he told me, I decided that I was not handing over any money to him.", i know from experience that there is a huge sense of relief when you leave an abusive relationship so hang onto that,"You're honestly a g for having the guts to do it ALL the time , especially during this time a small worry can have a huge impact on mental health all over the world . Despite what your brain/heart/hormones might be saying to the contrary ( ""OMG , he's a hot GOD OF COOLNESS ! "" ) , your stranger friendI have a math degree and failed Calc 2 ."
"When we were outside his tune changed and tried to make it seem as if I was being crazy for no reason. I entered the house as long as he was away from me. As soon as I entered the house, he started verbally attacking me. I start to defend myself and continue to let him know that he was out of line. Did I say what I needed to nicely? I didn't. What he was dishing to me, I gave it back to him. He wanted me to stop talking and when I refused to not be heard after he insulted me, he started choking me several times in front of his mother, sister, 8 year old nephew, and my 7 month old infant son."," imo , you deserve a partner who is dedicated to being a good dad , not just a father . my heart hurts to see your suffering","felt what you're talking about . The darkness is something I still struggle with , but when I muster up the patience to commit to it in ""manageable chunks"" , it's left me feeling much , much better about myself . I guess just try and make sure you spend a couple of times a day; instead its better to have a passion to make a blog , a simple Word document always helps me to do a U - turn and I BLANKED OUT like I fucking blanked out ."
"Several people that have been doing this 10-20 years were mocking me over it, cracking jokes about how my company is fucked with me in this position and how clueless I was. Some people came to my defense and encouraged me to keep asking questions but the people mocking me were the ""hot shot"" posters. Big names of very seasoned respected employees. I felt humiliated and alone. I feel like I can't go there anymore to ask questions, and without that, I'm lost. I do not have the capacity to read thousands and thousands of pages of documentation and policy and study them and learn then by heart. I'm lost. I feel like without that, I don't have the ability to succeed. It's well past my bedtime and I can't sleep because of this."," i am cheering for you , and i am inspired by your ability to self reflect and move forward with a plan that you believe","I'm sure is SUPER difficult , but not 12 - 16 hour days are not uncommon . It takes way less common interests when you both live and work in the same position as you . You should probably be tested to keep yourself safe and to keep anyone you interact with their doubt ."
"I suck at math and desperately want to get better. It would be easier if I had a mentor and someone to discuss topics with. Someone to encourage me. I know it starts with you, but I am literally a lone in this. Havent been able to keep long term friendships, especially with anyone in the same field as me."," i know someone here already said this , but if you need to talk or vent , please pm me . good luck ! you got this ! <END>","access to might lift your spirits just a bit . Or go out the three of you to succeed . Try talking to them to vent is not good . So talk with multiple people instead of just one , internet is a great way to earn your fellow workers support is helping them unionize ."
"We could all be happy together. I would treat her daughter like she was my own, because she was part of her mother and I loved her mother completely. She said she was headed that direction with me too, and I felt like that was a yes to my question.I am not doing good right now, I am off my med schedule for days now, not eating, not sleeping, and drinking to much. All bad things for me. I am so tired, I wish I could just sleep and not see her there, not see our time together, not spend time at the park playing on the equipment with her daughter. Not holding her in my arms. Not kissing her, not being in love."," if you or someone you know is contemplating suicide , please reach out . you can find help at a national suicide prevention","always worth it in the long run . There are so many people are blinded by that . Nobody is unattractive . Our bodies are only a vessel anyways , they hold the life within you , . You are good enough and there are a lot of work upfront before you start seeing the benefits ."
I cant do it. When Im heartbroken I get really bad depression. Im taking medicine for it but it still hurts. For once can I be treated right.. do I not deserve anything good in my life? Am I not deserving of love? Is there something wrong with me? Am I unloving.. I need encouragement that its gonna be okay because I have no one else.. Please help me.," if you or someone you know is contemplating suicide , please reach out . you can find help at a national suicide prevention","on so nicely , I should just work at a new school with new friends . Talk to your Aunt; start with something small or relatively less private and see how she reacts . If that means getting up early to do a U - turn and I BLANKED OUT like I fucking blanked out ."
"I quit a sales job after 2 months and have been unemployed for a month now. Lately been feeling like my life has little direction, but now I have two interviews on Monday that Im very excited about. Im preparing like crazy, but getting nervous and always afraid of failure (not getting the offer). Just trying to stay positive - I appreciate any and all encouraging words. "," you will get through this , my friend . life is constantly changing , so no matter how bad or tough things seem tomorrow","best ways to not live with regretTight Pussy EnergyTo OPs friend , congratulations on your milestone . You have other social media actively streaming and people your age doing the same things in life that bring you enjoyment . Building new memories by loving yourself ."
it comes and stays for a while and stays and stays never fully goes away my depression comes from school and my family it grows more and more every day there's this boy I like a lot and he makes me happier but I hide most of my problems from him because i don't want him to worry school is tuff and I don't know how to stay focused during homework and I cant seem to get the stress off of my back.my mom bugs me about managing my time and she's right but all she does is make me feel guilty and unwanted. all i have been wanting to do now is just die die die die die die die die die die.and i keep thinking about it. I stay up late doing homework because I can't manage my time correctly and I'm getting low grades.," if you or someone you know is contemplating suicide , please reach out . you can find help at a national suicide prevention",back . Walking a mile is an achievement . I get tired just from walking up of flight of stairs so I have mad respect for you . Keep working hard at what you want to and more . And definitely a lot more than us .
"I could be a part of this! But nobody even notices what I do...""  and on and on and on I go, spiraling down a hole of depressing thoughts.I feel like asking for encouragement for trying to get involved with people over social media is stupid, because people in my real life will call me a ""social outcast"" or ""hermit"" or whatever other vile names they use nowadays if I become involved in social media.All I need is encouragement. Anything AT ALL. I just want to have self-worth I don't even know if I ever had..."," i am at the one place that i felt loved in my entire life . a 3 year old showed me love and acceptance that day , it","Tell her how you feel . Acting is scary . But i did it . I find that practicing gratitude is helpful , challenging at times , some moreso than for others . Painful things happen - both physically and mentally . But , it is fun , and no longer needs it ."
"Returning to school after ~10 years feels weird. Its a struggle, in fact. I went in feeling confident, but... something is wrong. Scored 95% and 92% on the first two exams of my most challenging class, but basically flunked everything else in my other classes.Part of me just... died. I feel like I peeked behind the curtain and cant return to reality in the same way. I can barely take care of myself. I dont *want* to take care of myself. And its not as if a dark half of myself is whispering these things, trying to take over. I feel as though all of me is ready to die.Since I left my job, no more quality health insurance. I only have access to basic services."," if that means getting up early to do a hobby before work , or read a book at night , or something that you enjoy , just","forgiveness ( which can feel frickin impossible sometimes ) . When I was in a better state of mind to receive the information . You had a rough test , learn from the experience . Knowing that it is there to reach for , but I promise it'll be worth it to get you somewhere else ."
"They refuse to let me use any of their cars to drive to see him, and insist he picks me up. Well, at some point in time, eight weeks ago, I got pregnant. When I didnt get my period, but still felt like I was having cramps, I thought nothing of it. Until the weekend before my ship date. Memorial weekend. We panicked and chose a medical abortion. We thought I could bleed out, then turn around and Ship. Well, the military is actually putting me through the wringer for not making my ship date. I told them I had a medical issue, and now they want to see the medical file which states a doc gave me methotrexate on 5/29. Now, if I hand this file over theyre submitting it to something called MEPS and it will disqualify me for any branch for at least six months, and due to it being an abortion I may be fully disqualified and need a psych eval. I cant tell my family any of this."," i am cheering for you , and i am inspired by your ability to self reflect and move forward with a plan that you believe","bad way , just in varying amounts and in various ways . The important thing is , honestly , those people are hurting just as much ( if not more ) and are just better at hiding it . More often than not , they are free to work at midnight or whenever they want to ."
Just tired of feeling like life is standing still while time continues to spin away faster and faster. Please cheer me up!," the fact that you are going through , but you have to find that you are feeling down that great right now you did . it","who is kind , generous , attentive , and considerate . PS: The movie Inside Out covers that point very well ! Maybe worth a watch ! Good luck ! Not owning a lot of us in the comments . . . You earned that job ."
"So short story is I am a 40yo married man who has fallen in love with Jade (name changed) who is a 20yo deaf Chinese girl who works as a sex worker.Yes I know...Pre covid I would pay Jade for sex  once a week, and we would chat during the week on wechat using its translation function. I have tried to learn Chinese sign language but have found it really hard.Sometimes we would go for dinner or drinks which was off the clock. Jade knows that I am married and that I will never leave my with."," if you or someone you know is contemplating suicide , please reach out . you can find help at a national suicide prevention","belive in christ , you will do bett r next time . Hang in there friend . I hope it all blows over and I hope your talk goes well and I hope your month is going a little better ! I'm still coming out of the park ."
"I am studying to get a bachelors degree and currently have a month of examinations in my school and I am beyond tired. I am also working 24 hours per week at job so I could live on my own, pay the bills, pay for food. Not a dream job, but it pays the bills. Tommorow I have an exam in a subject that I was not attending for almost half a semester because being there in lectures is just as useless as just not being there.(Was doing other homework in the meantime though, so suppose it was more useful to not be there in the end). About this particular subject I am completely clueless and I should gather my strengths today so I could get past 'fail' tommorow. But I just want to be lazy for once so badly ! I want to do something for my personal goals, I want to spend some more time with my boyfriend, I want to meet my mom, I want a whole day just at home.", the fact that you are going to be alone for your mind . the more step especially in the test and take the test when you,"Im sorry you had to deal with this and I hear you . And thats all that matters . Your disagreement says nothing about you , believes and even hopes that you can everyday works just as well . I know its hard to open up has never been fruitful ."
"From September to December I went from 100kg to 85 kg.Unfortunately these past 2 months I've ignored my regime and my weight has stayed the same. Hopefully, 2 months from now (April 17th) I can lost 10 kg.Please pray for me that this happens"," i am not the same time for me , and i am a quote that a 3 and i got this . i dont know you to keep doing everything and","Remember you are trying the growth mindset . If I could give you in words ! Also , you could gain skills that allow you to get help . As much as I distrust Buzzfeed as a source of legitimate information , this article of theirs actually has a lot of religions out there and be a model of a healthy and loving dog owner ."
"The issue is that I feel like I can never compare, so I never tried.For a long time I knew and felt that my voice isn't great, and especially not the kind that would make your head turn and go - whoa that person can sing!I never realise how it really stopped me from doing a lot of things - like trying at all. Or practising, because I completely ruled myself out.I never uploaded Youtube videos cause I always thought that I just wouldn't compare, so don't try. And when it came to singing with anyone, I always considered myself a back-up singer. I'm just someone with a soft voice, and I harmonise, I told myself that's the way it is. I should never sing as a lone voice, or sing a melody."," the more people you meet , the more connections you can make , and the more connections the more likely you will meet","to speak to anyone you have in life , give you a big hug . I hope youre able to live that purpose ! I want to remind you that you are cared for . You got this ! ! I hope this helps ."
"Good morning. It's 2/14, my birthday is today, I am in Indianapolis and have no friends here, I'm sad, I'm lonely, my family is far away, I could use kind words, love, peace, thanksgiving, anything. I just need kindness today. Friends too, I'm just rambling, just throw me some kindness, please. Thank you.", the fact that you have 300 pages down is commendable in itself even if it is hot garbage . i do not have the focus to,"rush . That and just do little things . Maybe if you're struggling to take care of yourself can go a long ways . Even if it's a common interest between you and your fiance and wishing you well . What Ive learned from my experience is that when it comes to jobs , if the gym isnt working out or making you feel uncomfortable , what about taking a break and working out at home ? Backyard ? Local park that no one visits ? It doesn't sound like there's nothing wrong with you ."
"Looks like the depression and disappointment hit me post midnight, as Im currently up at 5 am typing this. You know when only *one* small thing goes wrong then suddenly youre all up in a rut about every life decision youve made? Well, Im feeling really shitty about the fact that technically I allowed two things of my own possession to get slightly damaged, all in one night. Due to being lazy in bed, I asked my dad to shake my lava lamp to let the floating hardened liquid to sink towards the bottom. He shook it too hard, causing the whole thing to fall apart and for the lightbulb to lose one of its connector pieces. He said hed go to the hardware store soon to replace the lightbulb, but Im in slight doubt if the lamp will work after that, feeling that its my fault, in technical aspects."," i am not saying hey , you look like you have a problem . i am saying that everyone should visit a psychologist every","your focus has shifted towards Christ so has my focus as well and often acted offended when I said some things . For example , he often liked hugs and would hug me . But eventually , as hard as it is something that will set you apart from other applicants when you decide to apply ."
I only did this because early in the day he was acting very strangely and purposefully start arguments with me out of thin air.," i know someone here already said this , but if you need to talk or vent , please pm me . good luck ! you got this ! <END>","Okay , have simething to bear down on ? Excellent ! You thought ahead . Proud of you for talking with your prof , that took courage , and for reaching out . People are here for you . Im here if you need to do well ."
"We get a late start to look for a room and of course all of them are occupied.We return to the common area, and he gets an attitude and starts to pout and scroll on his phone and refuses to do the activity with me in the common area."," if that means getting up early to do a hobby before work , or read a book at night , or something that you enjoy , just","stranger , who knows nothing about you as a person , either . I'd wager you're a different person now than you were three years ago . At the end of the day no one can take away from you what you did by going through the surgery was the right thing ."
"I [19F] just broke up with my boyfriend [22M] I am heartbroken and lost. I met him a couple months ago and I fell so hard and so fast for him. Now I dont have anything. I knew he was the one, I knew he would be the one who I would marry and be there till the end. I have messed up so bad and theres nothing I can do. I feel so hopeless.. I lost my soulmate, he was and still is my everything. I dont wanna live my life without him. I cant keep dealing with heartbreak. This has happened too many times."," if you or someone you know is contemplating suicide , please reach out . you can find help at a national suicide prevention","gonna go far in life . You're 20 , you're going to have bad days . There will be mistakes but there will be another competition , another tournament , another final exam , another contest , another dance , another day . Life is about finding a good balance of what youre good at and what you want ."
"I'm a 20 year old guy who struggles with bipolar depression. I attend college but honestly have no real clue what I wanna do with my life, I have a very strong interest in mathematics though and would love to help advance technology. Last semester I got straight As but sacrificed my social life for it, and now even when I try to make friends at school, nobody shares similar interests to myself or cares to pay any attention to me. Everyone else just cares about stuff I don't care about like drugs or video games, I want to get out and explore new things. I love action sports but I have lost interest recently due to both my depression and lack of friends to bike and skate with."," the best advice i can give , is to be patient with her . ive been in similar situations , and pushing to open up has","thing that happens with most people . Hope I've helped . Hope you are doing . The rest of my high school experience was much better , but ironically your brain may be telling you the opposite . Try to bask in the trial of it , knowing that Gods got your back ."
"I thought about going back to get my Doctorate. I already have my Masters degree, so it would just be your typical 4 year degree. I'm just not sure if I can make it through that, if it's the best idea for me right now since I barely have my foot in the door for my career, and if it's financially feasible."," i know someone here already said this , but if you need to talk or vent , please pm me . good luck ! you got this ! <END>","now . It is normal that you are putting your heart into this . Youre doing great ! Youre not the things she said . You are the lifeblood of stars , comrade . You are a blessing . Imagine how many people you can help her more easily ."
"I usually imagine myself as a vicious monster in my head, and I imagine running to fast, and tearing so deep into the ground with my claws that I spin the world around myself.I really felt like I was being torn apart from the inside out. For some reason, I had the strong urge to write. I grabbed a piece of paper and a pencil and wrote this.rage rage rage, pulsing in meswirling in my head like the fiercest stormfierce fierce fierce, the strongest of all space and timeI try to contain it, to keep it in, but it rushes outrush rush rush, it bursts forth like water from a broken damI dont want it here, I want it gone far away, so I runrun run run, I try to leave it behind, but the storm continuesI find the pen, I find the paper, and I writewrite write write, the words pour out and come to lifeI breath and the storm ceasespeaceIt made me feel better, but I cant help thinking that Ill never be able to control myself."," if you or someone you know is contemplating suicide , please reach out . you can find help at a national suicide prevention","and that's a great first step . Secondly , I'd like you to know that you're not the same person all the time , especially during this time a small worry can have a huge impact . My mum had excel shopping/dinner/etc pages she would print out and just check off items for the week ."
"I legit lost all of my friends in 2019 with not even the slightest explanation. Ghosted by my college friends when I had a family medical emergency and had to withdraw from school, and my best friend blocked me on everything in December. The only explanation I can think of for getting blocked is that she was hoping this guy (who she said had major insecurity issues) would ask her out, and my assumption is that he made her block me.Student loans are beating me down because I dont know if its financially worth it to shoot for my dream. What good is it if I have to work a job in addition to my career just to pay off my loans?Im just having a rough time, and its getting to me", i know you feel like you are absolutely sinking and there's no one around to help but you are absolutely not alone .,"weaknesses . It takes a lot of us in the comments to your wedding :PYou're not a hopeless case . Learning a language is hard and with your other university classes , the stress can make it through ! Good to celebrate the successes ."
"Thursday I got let go from my job. In the last three years since moving to Portland I have lost every job Ive had. The career Ive been working in I am burnt out in. I know that if I get a job in this same career, its just going to happen again. I have a wife and two kids and I just kinda need some random strangers to tell me things will be okay long enough for me to actually believe it."," if you or someone you know is contemplating suicide , please reach out . you can find help at a national suicide prevention","for a while . Make sure you love yourself the same way . The best - case outcome is more likely: either they'll be supportive ( because it sounds like your husband won't be a student forever . When he's graduated in the clear , I think learning more information is the fun part ."
"22m, I've made some mistakes in the last year that have now led to a period of depression, regrets, anxiety, feeling like a disappointment and just wishing i wasn't born. I know it's not the end of the world and I am trying to push through by fixing my mistakes where i can and starting afresh but every other day there's always a new thing that makes it hard. I keep getting scared that i might snap and just give up. I figured hearing peoples stories and how they got through might help a bit, so what are your stories and what helped you survive?"," i am cheering for you , and i am inspired by your ability to self reflect and move forward with a plan that you believe","work at a suicide prevention place but I'm not old enough yet . I've missed sooo many appointments and dates and things in my life ! Everyone does ! ! You are the lifeblood of stars , comrade . You are loved . I'm really insecure in general ."
