Input,Markov Chain Output,LSTM Output
"Im in too low of a funk to consistently care about maintaining my beard which is as frustrating as daily care would be. Ive been gaining fat all of 2020 which not only do I want to lose weight but Im also a nutrition major so thats not a good look. Ive been having toenail issues for about a year now, which tops it off for the head to toe partIm unemployed right now and couldnt get unemployment, so thats really rough. Im really thankful that money isnt as big of an issue as it would be for most people, but I find myself sitting in my car in a random parking lot just to get out of the house. I legit lost all of my friends in 2019 with not even the slightest explanation."," i know i might now be all the helpful . really , i am just a kid that might not know a ton and is still trying to figure","we get bored or stagnant , we turn to eating . Really think of the aftermath . Of course theres only so much you can control . It may be hard , but if not , all this person is doing is putting up a barrier to you finding that perfect match ."
Im not the perfect 14 year old girl my parents want me to be..I dont have good grades I cant stay focused but Im trying so hard but seem to accomplish absolutely nothing....Im just ranting about half of my problems that Im probably overthinking but yea sorry if i wasted anybodys time sorry for ranting....," if you or someone you know is contemplating suicide , please reach out . you can find help at a national suicide prevention","a dermatologist about . Also , take a look at www . iww . org . There they provide tips on organizing and fighting for a better future and possibly a better life than she has . I could be successful; be encouraged and ask God to guide you to where youre supposed to be difficult ."
"I have always struggled with anxiety and depression, and the current state of the world has compounded it a thousand times over. Between street violence to cities burning to COVID and political corruption on all sides, I feel like the only future for America is a bleak one. Im not suicidal, but I sometimes wish for an accident to remove me from this ridiculous society.   I need to know things will be ok, but I dont think anyone knows for sure."," if you or someone you know is contemplating suicide , please reach out . you can find help at a national suicide prevention","you want to further pursue this hobby , go for it ! You got this . 15 isn't bad , you got this . You have to let school make you sad . Use it to heal , or do something productive , even if it's going to take some work ."
"These past 4 days have been awful and I don't know what to do anymore. It all started on Thursday ( some context I'm 16) I got a call during school lunchtime that my best friend Jay(18) had been arrested for assault, he had beat his sister's  abusive boyfriend half to death so I'll probably never see him again but then an hour later I hear from my good friend John that my friend Mike(15) will be moving out of state because he got his girlfriend pregnant. Oh and not being able to see 2 of my friends wasn't enough I got pulled into the counselors office and told that I will be repeating earth science and that I will be taking a course over the summer."," i am cheering for you , and i am inspired by your ability to self reflect and move forward with a plan that you believe","that everyone should visit a psychologist every now and then because they learn for many years how to help people like us with their problems I wish You well ! Well , I am happy you are taking up the position to hold your boss accountable ."
"I'm feeling really low. A few months ago on I was promoted to my first management position. I was so excited to be In leadership and I really thought I could make a difference in someone's career. About 2 months ago I got my team, all new hires, and almost all straight out of  college with little or no job experience. They are so rough. After rigorous training almost all of them are rough, to be expected of course.What I wasnt expecting is to have 4 HR issues right of the bat and them escalating me to leadership above me. I have 3 that are are written warnings for attendance, 1 more and will be termed. 1 went to my leadership and asked if I was right. Unfortently I so know this may happen as people might be unhappy, especially if they are having performance issues. All day my leaders tell me that i have such a bad team and they feel so bad for me, that I'm doing great handling it and it's really breaking me in."," if you or someone you know is contemplating suicide , please reach out . you can find help at a national suicide prevention","worst . Your father might be looking for some love and support you need elsewhere . "" \ - Jonathan Lockwood HuieIt cuts you down when people sneer , smirk , joke , bully , make fun of , etc . You do you , unapologetically ! Always better safe than sorry ."
"I'm 19, I weigh 235 lb I used to be 250 at the beginning of the year, but it's really hard to keep exercising. Just today I was at the gym not 10 minutes ago and a couple of super skinny super hot girls just snickered at me. Part of it's probably because I'm paranoid but I feel like they were saying look at the fat girl trying to be like us Jesus Christ she doesn't f****** belong here. And so I ran home. I don't know if I can keep going to the gym and having those negative experiences. I'm just to anxiety-ridden and depressed to not go to the gym but at the same time when it's making those symptoms worse... I don't know I just need some encouragement."," if you or someone you know is contemplating suicide , please reach out . you can find help at a national suicide prevention",is in control . There's always a way . Acting classes are also great places to make friends . So dont give up . Always remember that therapy is always an optionHey friend . Im sorry you are feeling better . Take the leap .
, one night he went to sleep i packed my bags left . it took 6 months to save up . i stayed strong and focused . <END>,then give your situation so that way you guys can relate to the self - loathing and a deep seeded desire to be destroyed . . . some random guy on the internet but everyone needs to read this ! If youve been questioning whats the point of life here it is .
"Ive been dealing with very negative thoughts and emotions as of late, and I just feel awful about myself. I just need to know Im a worthwhile person.", you got this ! i know how you have an feeling through that you can absolutely do great . <END>,top is around the corner . Don't rush it and try to focus on how to prepare for the exams . I remember every time I broke down shaking and crying because of not meeting the deadlines for school and after working with my teachers and making an effort I'm doing much better now .
"I have a part-time retail job which admittedly I love, mostly because of an awesome manager. But it's not enough to live on, so I'm planning to get some electrician training. There's always a market for that, they're unionized, and I love working with my hands. So far, so good. I've located a technical college that:\- is less than half an hour from my house (\*super convenient\*)\- has a six-month certificate program (\*not so short that it feels incomplete, not so long that I get frustrated\*)\- offers job placement assistance after graduation (\*SCORE!\*)\- classes start at 7:45 AM (\*record scratch sound effect...\*)Oh dear.", i think you will find that when you practice self care in these kinds of ways and in ways that are right for you . .,"really nerve - racking , but it really sucks now . If I may make a suggestion , I would . So heres a virtual hug: . Well I did not post so that I forget about what I was thinking about . As far as money goes , it might be this person ( I hope it gets better , it isnt always worse , but its always a new day ."
I don't know why I'm posting this but I'm at lowest point of my life where I feel like everythings falling apart along with me.," i know someone here already said this , but if you need to talk or vent , please pm me . good luck ! you got this ! <END>","miles 24 . 1 kilometres ^ ( 1 mile 1 . 61km ) ^ ( I'm a bot . use ! unsubscribetosadcat for me to be sad/irritated but I am Honestly , college is kinda rough and very few college kids are ""stable"" at 20 ."
"I want to do all the things we talked about doing, the bucket list of family adventures.I dont know that I will get over this breakup, not even sure it would be called a breakup more like a harsh dump from her. I am of no value anymore, I don't even have enough value to say goodbye to. I only desired to be wanted, someone who would want to be with me, who wanted me to be part of their life, someone who loved me. Unconditional love, a love that is true.I want to die right now, and I hate myself for going that direction. I just want this pain to end. I just cant find a reason to stay here in hell only waiting for the next woman to crush my heart. There is such a deep pain in my chest, it hurts each time my heart takes a beat."," if you or someone you know is contemplating suicide , please reach out . you can find help at a national suicide prevention","a mentor you admire . Believe in the power of your own determination . If I were to make a difference and be happy . Hi there ! Believe it or not , youve actually set yourself in the mix of life . Maybe you should work on that ."
"Ive had this million dollar idea kicking around where I want to start a business with an emphasis on remote flexibilty and results-focused work, but Im too worried to take the plunge and start because Im worried people would shoot my idea down because of X Y and Z. Get a real job instead.", i know from experience that there is a huge sense of relief when you leave an abusive relationship so hang onto that,"in a system designed to see you fail . Remember you have to deal with this . I hope it goes how you dreamed , but if it is hot garbage . I don't know if you're much for praying , but I do want to share your music , at least one way to achieve your dreams ."
"I've had a hard time recently because my crush wasn't interested in me. For me, it's been on the rare occasion I feel a special connection with a girl so I have little experience with relationships/dating. Ive only be in a relationship once in the past 3 years and it's kind of taken its toll on me. It's nothing wrong with me (I think), I consider myself an all around good person. It just hurts me on the days when I need a hug or someone to talk too.Any advice on how to feel better?(I'm not sure if this is the best place to post, let me know if there is a better place)"," if you have not accepted that you have a disease that needs treatment that is a first step . next , get treatment for","out of depression , and I understand your feelings :/ but it'll get better ! One of these times some of the most rewarding/enjoyable times in life , and try to let go . Love is real , so is heartache . In the end , youll know a lot more to being smart than just being able to pass tests and quizzes ."
"Im 16 and applied for a job and got an interview, originally scheduled for next week... turns out they messed up in the email and now my interview is today at 12:30. I have very little time to prepare myself and need words of encouragement."," if you or someone you know is contemplating suicide , please reach out . you can find help at a national suicide prevention","in common and a l o t i wanna say to you to make it for us . And make it for you . May others treat you better and may you treat yourself better . If you start to feel yourself getting anxious , take a shower , take your meds ."
I now noticed since then things have gone downhill.Long story short she made me feel used worthless and broken. That I dont have my life together and cannot be a Provider. But I know these are not her words. Unfortunately nothing I say will bring her back. I just need some assurance Im not those things she said. Please., you can do this . if you want change you will do anything to do it . just remember you can do this ! ! ! ! ! ! believe,"everyone else . So you've got a secure job , your own place , mortgage paid , and moving forward . Life can be tough . In all reality your parents *do care . * They can help you figure this out . It's going to be good at math , and couple that with the work youve got to put in ."
"In the past week alone, Ive gotten two 45s on quizzes and i feel like everything is crashing around me. Im not even doing poorly really (all As and a B) but my peers are doing better than I am and dont hesitate to tell me that. I dont want to do worse than I am, and honestly I cant afford it. I dont even know what im doing, and everything is just too much."," if you or someone you know is contemplating suicide , please reach out . you can find help at a national suicide prevention","EEET NAOW ! \[insert Arnold clip here . \]If not , then don't . Have fun ! Hey bookluvre . Hope this finds you well . What Ive learned from my experience is that when it comes to jobs , if the work environment is good , but not 12 - 16 hour days are not uncommon ."
"I need some help. I'm having a lot of trouble mentally and don't want to burden friends and family with my issues. I don't want to burden anyone really. But I guess strangers are better in this scenario. Lately, I don't want to be here anymore. I don't necessarily want to kill myself persay just not exist. I'm feeling like a complete failure and that the world would be better off if I wasn't in it. I'm not remarkable. I'm not going to change the world (although that's what I thought I was suppose to do). At best I will live an average normal existence. I hate that in order to even remotely be alright I have to take medication for the rest of my life. Anxiety and depression overwhelm my life. It's been going on to varying degrees now for the last 20 years."," i am cheering for you , and i am inspired by your ability to self reflect and move forward with a plan that you believe",don't buy it it kinda makes me happy and feel like I am weird too . As I read your old post on being ex muslim and theres a lot we have in common and a l o t i wanna say to you to make you feel better soon .
"I'm really scared living in Canada and being poor and mentally ill.I suffer from neurological and mental disorders and have always had trouble keeping work. I'm in an affordable city ( Montreal ) but really want to go, but everywhere I look it all seems even more expensive than it was.Toronto is not doable, Hamilton has gone up a lot too. I could really only afford a shared apartment on minimum wage ( if I could keep the job ) and disability isn't enough for a 1 bedroom either. Living with others can be very stressful, of course not as stressful as being homeless, I know I was once for a short time.I just feel so depressed being poor and mentally ill in Canada, like the raising rent and costs of food, ect makes it no longer a place for poor people, minimum wage workers."," you are right about the current state of the systems here in canada , the minimum wage workers can not afford to live",too are just as vulnerable . There are better people to give you any advice whatsoever but I will do my best . Trying to fight the negative thoughts and feelings I believe in the American citizens . Good luck on them my friend .
my friend told me to stop and I did but now I feel like doing it again and I dont know what to do....I cant tell anyone about it because Im afraid they will try to help or even judge me.," if you or someone you know is contemplating suicide , please reach out . you can find help at a national suicide prevention",therapist as that therapist probably has the best advice for you . Weight loss . No judgement gym stares . Hells yeah . let them eat cakeLife Alert can be so helpful for those who have mobility issues and so many people just like this .
"It's practicality become an addiction to get on Xbox the second I get home instead of practicing guitar or working out, stuff I want to do. Even when I thought I could trust him for good advice when I told him that I was depressed he said some bullshit about, ""depression isn't real,"" and ""most people are just looking for pity."" It's degrading to talk to him, and his posy. I just don't know if it's worth it to abandon years of voices and personalities for something I'm not even sure if I have the commitment to do. What do you guys think?", so many thoughts of experience and wisdom i just dont know where to start . first you are not the reason for being alone,"recovery . It sounds like this is a time to find what you want to act , then you should . Find any venue or play or musical or show that you want to and more . And definitely a lot more anxious lately and Ive done the same procrastination - due - to - anxiety thing for a while and asked them their thoughts , and then keep trying when its hard ."
"Hello, im not sure if i will continue to share my encouraging thought because people have been having problems because i use my faith to try to help people i was asked to only post everyother day because apperently im offending people, i dont understand why this offends anyone, if you dont want to read it then dont. But if you like these words of encouragement please respond!!! Henceforth I call you not servants; for the servant knoweth not what his Lord doeth: but I have called you friends; for all things that I have heard of my Father I have made known unto you. John 15:15 KJV
Dogs love is unconditional, always there for you, always glad to see you, ready to forgive you, love going places with you, will protect you from danger, and on and on. We would be fortunate to have a human friend who is faithful as a canine friend. Actually, we do have such a friend and such more than a four legged friend.", i know from experience that there is a huge sense of relief when you leave an abusive relationship so hang onto that,"much responsibility for a friend to have to talk you down from those close calls or not knowing the difference from a call for help and eventually got to the point when I usually didn't bother because if I did ask , I'd be so nervous I couldn't grasp it that I didn't ."
"We talked about getting a house together and cooking dinner and watching movies and playing with her daughter, we created a life that we both wanted. I met her very young daughter and fell in love with them even more quickly. She told me she loved me and wanted a future with me. We promised that if it wasnt working out we would tell each other and not just ghost the other, we did a pinky swear that we would not breakup over text, that we would not ghost each other as it had happened to us both, we would show each other the love we feel in that moment as a promise.We did OK for the few weeks after she was laid off and we couldnt go out as much."," if you or someone you know is contemplating suicide , please reach out . you can find help at a national suicide prevention","But , once again , a story of a bad teacher in the school system . why do these teachers exist ? the school system . why do these teachers exist ? the school system . why do these teachers exist ? the school system ."
"I feel like I've been getting positive vibes.1. (go over to her house to procure sub legal flowers, and she bites my shoulder.)2. calls me over at 2a.m. to hang out....( i get black out drunk and puke in her sink.  Wake up in her bed and she makes me breakfast.)3. Is hosting this Karaoke and invites me, of course I come.  Hugs me more than normal people hug (I'm a hugger and its more than I would do.) Also, keeps looking at me.4.ect.....But I get dumb in my brain sometimes cause anxiety and depression.....Like I'm pretty sure that all I have to do is be ""Hey grrrr, What up?"" but I don't because reasons.Maybe words of encouragement from Rando Calrissian might help me get over myself and be like ""Grrrrr, What up?""", the fact that you have 300 pages down is commendable in itself even if it is hot garbage . i do not have the focus to,"all of the details and ideas fleshed out for you someday . Best wishesHey friend . I dont have kids , but my mum was a single parent for ages and part of how she managed to make sure youre okay ! I know you are able to take this first big step forward , and I am sad and it irks me that health workers are seemingly underappreciated by the government in my country ."
"I know my problems aren't worse than others. I know of all days today is definitely one of the easiest situations I've been put through in life. Today just hit me differently. I woke up really groggy and sleepy to get ready for work while worrying about my gf who has spine complications causing her endless pain. I tried to drive to work after pulling myself together but couldn't go because the road to get to my job was replaced by a ditch for construction.I have been raped, beaten by family, bullied most my life and jumped on multiple occasions. But today? Today feels so. Hard. I know I shouldn't be feeling sorry for myself but I really need a hand to be able to stand right now. I'm crying and have no idea why maybe it's just mood swings but everything feels awful and I don't know how to fix myself", my friend . you are all going to be your best . and thats great . <END>,"sometimes . but I'm curious , why do you think this 9th - grade teacher did this ? One day at a time . No matter who you are . Try to plan something fun with people you care about get lost . There are people and resources , it's a good one - you'll recover lost progress way more quickly than it came to making friends because I was able to get past something but , over time , I always did ."
"So I went from $60 to $8 cause I didn't know my netflix bill and hulu bill happened today. So after I bought drinks and two cool bracelets for myself, I didn't have enough money to buy my pizzas. I was at target and I had put two digornio's stuffed cheese pizzas in my cart and I was trying to check my bank finances cause I always get paranoid that money is going to disappear. But I had $40 after I bought my bracelets. So I knew I had enough....but when I saw I only had $8. My heart sank....because....I'm the type of person who never buys anything for myself because I have always been broke. I have been scammed out of money through my parents. I have had precious items sold from under my nose by family.....I once had a $100 electoric guitar and $50 amp bought for christmas one year....I didn't even have that for a year."," i am at the one place that i felt loved in my entire life . a 3 year old showed me love and acceptance that day , it","go on 15 minute walk . That's the first place . Please pm me if you need to talk to her ( dont argue , dont raise your voice ) . Maybe even *the* defining virtue . Thanks for choosing to be a nurse , for instance ."
"Im a freshman in college and recently I moved about an hour away from home to attend school. The past few months have been absolutely dreadful, from moving in to an apartment to being late on rent every single month. My parents are separated so theyre always fighting over who should help me when money gets tight. Ive ran through about 3 jobs at my new location and cant seem to find the best job to keep me steady. I turn 20 literally on Friday and the fact that Im 20 with no stable income and barely getting by is killing my motivation and the way I want to handle things in life."," i am not gonna judge and i am here for anyone who needs me , promise . take care and peace be with you . <END>","get an art teacher in your school to supervise a cosplay club and do that . For me right now , but through perseverance and by self belief you will look back in 3 months and remember the little things that light a flame of interest or joy , and follow them like a firefly in a summer night , they will lead you ."
"Right now Im sitting in my dark and empty house and I dont know if I can do this thing called life. Ive been battling this demon for years now. No one knows whats really going on with me. Ive tried to talk to people about it but they all have the same carbon copied answers - Youre gonna be okay. Itll get better soon. Im sorry youre going through this. I dont think I will though. I know I need to talk this out with a professional, but I cant afford that or the insurance to cover it. Its cruel how the world keeps on going after your own world lies in ashes at your feet. Tbh, I feel empty inside.", i know you feel like you are absolutely sinking and there's no one around to help but you are absolutely not alone .,"As for your friend , but I would like to be the fault of anyone it just is what it is . I'm on my last year of art college too . He only got one offer out of all of it rather than turning away from the toxic that drags you down , be aware of what is happening , look up , and people aren't always understanding or kind about it ."
